{
  "session_id": "a7c5d8c6-2e5a-40cd-a3f4-cda09ef85e92",
  "contracts_version": "0.2",
  "patient_ref": "demo-phantom-hand",
  "program_ref": "headset-default",
  "mode": "simulation",
  "started_at": "2026-10-08T08:59:49.7746965+00:00",
  "ended_at": "2026-10-08T09:03:08.8098236+00:00",
  "end_reason": "completed",
  "device": {
    "model": "quest-link-editor",
    "device_id": "editor-eb9eb776",
    "os": "Windows 11  (10.0.26300)",
    "tracking_rate_hz": 72.0
  },
  "versions": {
    "shell": "0.2.0",
    "sdk": "0.1.0",
    "games": {
      "phantom_hand": "0.1.0"
    }
  },
  "calibration": {
    "affected_side": "none",
    "dominant_side": "right",
    "arm_length_m": {
      "left": 0.55,
      "right": 0.55
    },
    "posture": "seated"
  },
  "blocks": [
    {
      "index": 0,
      "game_id": "phantom_hand",
      "game_version": "0.1.0",
      "params": {
        "demo_mode": true,
        "offset_cm": 15,
        "stroke_rate_hz": 1.0,
        "induction_s": 90,
        "condition_order": "async_first",
        "stimulated_side": "right",
        "threat_enabled": true,
        "async_delay_ms": 600,
        "stroke_jitter_ms": 150,
        "tactile_lead_ms": 40,
        "motor_soa_ms": 833,
        "haptics_enabled": true,
        "haptic_max_intensity": 1.0,
        "motor_a_from_wrist_cm": 5,
        "motor_spacing_cm": 10,
        "forearm_length_cm": 25,
        "follow_during_induction": false,
        "agency_enabled": false,
        "emg_threshold": 0.3,
        "autonomous_close_enabled": false,
        "voiceover_enabled": true,
        "voiceover_lang": "en",
        "dissolve_enabled": true,
        "passthrough_reveal": true,
        "self_touch_s": 15,
        "breath_enabled": false,
        "breath_replay_lag_s": 20,
        "seed": 20261008
      },
      "started_t_ms": 0.0,
      "ended_t_ms": 199068.4748,
      "completed": true
    }
  ],
  "chunks": 40
}