{
  "session_id": "13de4e9b-8ba3-4b2f-af09-155e2589adfd",
  "contracts_version": "0.1",
  "patient_ref": "synthetic-longitudinal-9000",
  "program_ref": "synthetic-program",
  "mode": "simulation",
  "started_at": "2026-01-08T09:00:00Z",
  "ended_at": null,
  "end_reason": "completed",
  "device": {
    "model": "synthetic",
    "device_id": "sim-0",
    "os": "sim",
    "tracking_rate_hz": 72.0
  },
  "versions": {
    "shell": "0.0.0-sim",
    "sdk": "0.0.0-sim",
    "games": {
      "orchard_reach": "0.1.0"
    }
  },
  "calibration": {
    "affected_side": "right",
    "dominant_side": "right",
    "arm_length_m": {
      "left": 0.6,
      "right": 0.6
    },
    "posture": "seated",
    "chest_reference": [
      0.0,
      0.0,
      0.0
    ]
  },
  "blocks": [
    {
      "index": 0,
      "game_id": "orchard_reach",
      "game_version": "0.1.0",
      "params": {
        "trialCount": 6,
        "side": "alternate",
        "reachPercent": [
          50,
          85
        ],
        "azimuthRangeDeg": [
          -45,
          45
        ],
        "elevationRangeDeg": [
          0,
          40
        ],
        "holdMs": 300,
        "timeLimitMs": 15000
      },
      "started_t_ms": 60.0,
      "ended_t_ms": 19194.444444444445,
      "completed": true
    }
  ],
  "chunks": 4
}