{
  "session_id": "e5f243f8-8572-44cb-a460-0ef08cf0b9ab",
  "contracts_version": "0.1",
  "patient_ref": "run9-haptic-test-patient",
  "program_ref": "run9-haptic-test-program",
  "mode": "simulation",
  "started_at": "2026-09-18T17:18:19.6622965+00:00",
  "ended_at": "2026-09-18T17:18:34.0038466+00:00",
  "end_reason": "completed",
  "device": {
    "model": "editor-playmode-test",
    "device_id": "run9-haptic-test",
    "os": "windows-editor",
    "tracking_rate_hz": 72.0
  },
  "versions": {
    "shell": "0.1.0",
    "sdk": "0.1.0",
    "games": {
      "orchard_reach": "0.1.0"
    }
  },
  "calibration": {
    "affected_side": "right",
    "dominant_side": "right",
    "arm_length_m": {
      "left": 0.55,
      "right": 0.55
    },
    "posture": "seated"
  },
  "blocks": [],
  "chunks": 0
}