{
  "session_id": "fdf86238-1616-4eb1-ad3c-04b1301e5c06",
  "contracts_version": "0.1",
  "patient_ref": "run12-pipeline-patient",
  "program_ref": "run12-pipeline-program",
  "mode": "simulation",
  "started_at": "2026-09-18T19:15:36.4408580+00:00",
  "ended_at": "2026-09-18T19:15:36.4433724+00:00",
  "end_reason": "completed",
  "device": {
    "model": "editor-playmode-test",
    "device_id": "run12-full-pipeline",
    "os": "windows-editor",
    "tracking_rate_hz": 72.0
  },
  "versions": {
    "shell": "0.1.0",
    "sdk": "0.1.0",
    "games": {
      "orchard_reach": "0.2.0"
    }
  },
  "calibration": {
    "affected_side": "right",
    "dominant_side": "right",
    "arm_length_m": {
      "left": 0.55,
      "right": 0.55
    },
    "posture": "seated"
  },
  "blocks": [],
  "chunks": 0
}