{
  "session_id": "550e8400-e29b-41d4-a716-446655440010",
  "contracts_version": "0.1",
  "patient_ref": "pat_001",
  "program_ref": "prog_001",
  "started_at": "2026-09-14T10:00:00Z",
  "device": { "model": "Meta Quest 3S" },
  "versions": { "shell": "0.1.0", "sdk": "0.1.0" },
  "calibration": { "affected_side": "none", "arm_length_m": { "left": 0.65, "right": 0.65 } },
  "blocks": [
    { "index": 0, "game_id": "orchard_reach", "game_version": "0.1.0", "params": { "side": "right", "trialCount": 10 } }
  ]
}
