{
  "session_id": "c93ae4fa-3a21-4c7b-9bb6-cbe77c98e0b7",
  "contracts_version": "0.1",
  "patient_ref": "synthetic-longitudinal-9000",
  "program_ref": "headset-default",
  "mode": "clinic",
  "started_at": "2026-09-18T22:02:26.3961078+00:00",
  "ended_at": "2026-09-18T22:02:58.5005063+00:00",
  "end_reason": "completed",
  "device": {
    "model": "quest-link-editor",
    "device_id": "editor-4c99eda6",
    "os": "Windows 11  (10.0.26200)",
    "tracking_rate_hz": 72.0
  },
  "versions": {
    "shell": "0.2.0",
    "sdk": "0.1.0",
    "games": {
      "orchard_reach": "0.2.0"
    }
  },
  "calibration": {
    "affected_side": "right",
    "dominant_side": "right",
    "arm_length_m": {
      "left": 0.55,
      "right": 0.55
    },
    "posture": "seated"
  },
  "blocks": [],
  "chunks": 7
}